801,640407,Flight Control,"Control the skies in this engrossing worldwide hit from Firemint. Play solo or with up to three friends. Take on the role of an air traffic controller at an increasingly busy airport. Direct aircraft to their landing zones, but don??????t let them collide. Sound easy? As more and more planes begin to arrive, you??????ll need nerves of steel and smart strategy to keep the chaos under control."
802,954374,FlingSmash,"FlingSmash combines the hands-on fun of tennis with the nonstop action and instant gratification of pinball. When the tropical Suthon Island is invaded by the evil Omminus, the ball-shaped hero, Zip, is summoned to save the day. Using the Wii Remote controller with the Wii MotionPlus accessory, you'll fling Zip at targets to smash your way across eight colorful worlds. Use the Wii Remote like a racket and watch Zip bounce around like a pinball to smash through oncoming barriers and enemies in this action-sidescroller."
803,960343,Flip's Twisted World,"A unique gameplay mechanic is at the center of Flip's Twisted World for Wii. This puzzle platform game puts the world literally in the palm of your hand as you navigate topsy-turvy landscapes where up and down, and left and right are only a matter of perspective. Players will help the curious magician's apprentice Flip rotate the environment 90 degrees at will to solve puzzles and ultimately help Flip escape his cube prison."
804,950801,Flock!,"FLOCK! uses a sophisticated physics engine that drives the challenging puzzle elements of the game. Whether it's using the Tractor beam to move obstacles out of the way, or the Depressor beam to stamp out crop circles to guide your herds, being an extraterrestrial has never been this addictive. Friends can also join in through co-op play. And when all the levels have been completed, users can make their own with the level editor that comes with the game. Flock comes packed with so much content, the potential fun is out of this world! Over 50 levels of pastoral puzzle challenges. Explore levels to find secret collectables and upgrades. Level Editor allows players to make their own plushie and puzzle-filled levels and share them with their friends online. Two-player local co-op mode makes the flocking exponentially fun. Compelling environments complemented by a whimsical art style, beautiful lighting and distinctive textures make this one of the most graphically-advanced downloadable titles to date. Real-world physics engine creates all new types of puzzles: pick up wooden planks to form bridges, move items to create obstructions, crush wheat into pathways."
805,935675,flOw,"flOw is a game about piloting an aquatic organism through a surreal biosphere where players consume other organisms, evolve, and dive into the abyss. With an embedded design of DDA (dynamic difficulty adjustment), players with differing skill levels can intuitively customize their game experience and enjoy the game at their own pace."
806,943340,flower,"The pioneers that brought you the award-winning PLAYSTATION Network title flOw are back with another concept that challenges traditional gaming conventions. Flower expands the team's tradition of delivering simple gameplay, accessible controls and a medium to explore emotional chords uncommon in video games. In Flower, the surrounding environment, most often pushed to the background in games, is pulled to the forefront and becomes the primary character. The player fades from an external and stressful world in the opening of this fresh and genuine game only for PS3, and journeys through beautifully vivid landscapes, changing the his surroundings and exploring nature along the way.Playing as the wind, the player guides and grows a swarm of pedals by interacting with other flowers and the surrounding environment. The goals and journey in each level vary, but all involve flight, exploration and interaction with the level. Using simple SIXAXIS wireless controls, the player guides the lead petal and accumulates a swarm of flower petals as he moves at his own pace within the environment, causing the on-screen world to change. Flower's gameplay offers different experiences, pacing and rhythm to all players. Along the way, the environment will pose challenges to the player's progress.Both pastoral and at times chaotic, Flower is a visual, audio and interactive escape on PS3."
807,973239,Flowerworks,"While our heroine Follie is traveling to meet her auntie with a cargo of mystical Flowerworks seeds, her ship is pulled off course and crash-lands in a particularly dull area of the planet Elilia. Explore with Follie and help her recover her seeds to transform the world from drab to fab. You'll encounter strange inhabitants, some of whom will help Follie in her quest. Others, such as naughty garden gnomes, will hinder it. Flowerworks is a single-player adventure which combines blooming flowers, colorful fireworks, exploration and a whole lot of fun. The game will have the whole family immersed in no time, but be warned: Becoming a Flowerworks master is not for the faint of heart. Flowerworks includes Adventure, FreePlay and Tutorial game modes, with three difficulty settings in a 20-hour adventure."
808,611875,Fluidity,"A magical illustrated encyclopedia called Aquaticus has been tainted by a vial of evil ink called the Influence. As a pool of water that can take on alternate forms of ice and steam, you must overcome obstacles scattered across the pages of Aquaticus and save it from the corruptive Influence. Tilt and twist your Wii Remote controller to use the various forms and properties of water on your free-flowing journey through Aquaticus, where every page has multiple panels and illustrations that come to life. Tackle problems and defeat enemies to reveal magical Rainbow Drops, each of which will restore some of Aquaticus' power and allow it to open more chapters and grant you new powers. These additional powers, such as sticking to objects as a block of ice or shooting bolts of lightning as a steam cloud, will be essential to destroying the Influence and its minions. Along the way, you can also test your ingenuity and reflexes by finding hidden puzzle pieces. These pieces unlock playrooms that give you the opportunity to use the skills you've learned and race against the clock to complete as many challenges as possible. These challenges won't affect your quest to restore Aquaticus' powers, but everyone needs a break now and again, right? Fluidity offers the chance to slosh and slide your way through an imaginative environment filled with challenging adventures. Are you ready to dive into this unique experience?"
809,930085,Folklore,"Folklore is a unique, dark fantasy adventure inspired by western fairy tales. Set in the mysterious town of Doolin, two strangers, Keats and Ellen, are drawn together to uncover a mysterious legend in a remote village that exists on the border between dreams and reality. They soon learn that the town serves as a gateway to fantastic realms, full of creatures, spirits and monsters. In order to solve the mystery of the town, and their past, the pair must journey through these worlds to uncover its secrets."
810,959890,Food Network: Cook or Be Cooked,"With inviting introductory lessons for the novice cook or for foodies who want to put their gastronomic skills to the test, Food Network: Cook or Be Cooked will provide everyone with the proper instructions to become a star chef no matter the experience level.  Designed in collaboration with the executive chefs of the Food Network Kitchens to ensure authenticity, Food Network: Cook or Be Cooked is a fun and entertaining game that can improve a player's cooking skills. Utilizing the Wii motion control capabilities, players will learn as they play through fun and delicious recipe challenges that range from breakfast to family dinners."
811,971402,Football Genius - The Ultimate Quiz,"Football Genius - The Ultimate Quiz gets underway with a brilliant kick-off that incorporates more than 3,500 different questions and six football packs with reference to football leagues around the world including, English, French, German, Italian, and Spanish.  The quiz allows for up to four players to compete for the best score with subjects ranging from general football trivia to true insider questions, testing players' knowledge of all things related to the vast world of football."
812,944519,Ford Racing: Off Road,"Off Road takes the multi-million unit selling Ford franchise away from the tracks and urban streets of its predecessors, to rugged, tough terrain for the very first time. Off Road also marks the introduction of the prestigious Land Rover brand, synonymous like Ford, with a rich heritage of producing pioneering off road vehicles. Players can now race some of the world??????????????s toughest off road trucks, 4x4??????????????s and SUV??????????????s through beautifully detailed environments, stunning, scenery and wide sweeping tracks designed for rough-tough, high-speed racing.With real-time, on-the-go vehicle damage repair, acceleration faster than any previous Ford game, and alternative routes, Off Road brings a plethora of new and exclusive features to test players' driving prowess at high speed. The racing has never been this exhilarating!"
813,928392,Formula One Championship Edition,"FORMULA ONE Championship Edition roars onto PS3 with all the official drivers, cars, circuits, rules and teams, including SCUDERIA TORRO ROSSO, SUPER AGURI F1 TEAM and MIDLAND F1 RACING in their debut year. Next Generation Experience - High definition visuals, full surround sound, extensive circuit details and lighting effects, progressive dirt and car damage make for a realistic racing experience."
814,632973,Fortune Street,"Players become familiar characters from the Nintendo and DRAGON QUEST universes in a board game that challenges them to play the real estate and stock markets wisely to win. Players race around the board trying to accumulate wealth and hit a target value while buying, selling and trading property with friends and family to see who can be the first to cash out. What appears at first to be a simple property-buying board game offers multiple levels of money-maximizing opportunity."
815,662534,Forza Horizon,"Forza Horizon combines legendary Forza authenticity with a festival atmosphere and the freedom of the open road. Forza Horizon offers an immersive pick-up-and-play open road racing experience and features the unrivaled realism, diversity, and innovation that are hallmarks of the Forza franchise."
816,932731,Forza Motorsport 2,"From the all-new world famous Nurburgring Nordschleife and Sebring tracks to the spectator-lined streets of New York City in the New York Circuit, race on meticulously designed tracks with an incredible sense of speed and realism. Forza Motorsport 2 features over 60 tracks carved out of 18 environments, including 13 real-world licensed circuits such as Road America, Silverstone, Tsukuba, and Laguna Seca. Four new real-world licensed circuits further expand the world of Forza Motorsport 2. Collect, upgrade, and tune hundreds of cars. From sport compacts to purpose-built race cars, collect more than 300 cars from over 50 of the world's leading manufacturers including Ferrari, Porsche, Nissan, VW, GM, and Lamborghini. Take your car to the garage and install alternative engines, suspension kits, bolt-on superchargers, brakes, rims, racing slicks, and more. Dial in advanced suspension settings, tire pressure, and gear ratios. Forza Motorsport 2 allows you to own the cars that will own the competition. Create and share your masterpiece with the world. Express your inner artist in the paint and upgrade shops with near endless visual personalization. Customize the shape of your car by combining different licensed rims, performance parts, and aftermarket body kits. Create your own unique paint scheme using millions of paint and decal options. Take in-game pictures of your creation in the Forza Motorsport 2 photo mode. Take your personalized car onto Xbox Live for some intense online wheel-to-wheel racing. Earn in-game credits and even complete single player career objectives while racing over Xbox Live. Watch the best racers from around the world complete on Forza Motorsport 2 TV."
817,948030,Forza Motorsport 3,"Whether it's an exotic sports car like the new Audi R8 V10, a classic American muscle car such as the Ford GT, or a hot Asian import such as the Nissan 370Z, everyone has a dream car. Now you can drive that dream with Turn 10's latest racing epic, launching this October exclusively for Xbox 360, Forza Motorsport 3. The game makes it possible for everyone to experience the thrill of owning the world's most exotic and exquisite cars. Live the most realistic racing experience ever as you take the wheel of more than 400 of the most-beloved cars on over 100 renowned real-world tracks and exotic road courses from around the globe. With breathtaking HD graphics and the most advanced vehicle performance modeling in a video game, Forza Motorsport 3 includes a host of driving assists and adjustable skill levels to make the game a gripping pick-up-and-play experience for audiences of all ages and skill levels. A love of cars lives in all of us. Forza Motorsport 3 is the automotive playground we've all been waiting for."
818,997653,Forza Motorsport 4,"Forza Motorsport 4 takes innovative leaps forward in the racing genre, delivering stunningly beautiful graphics, a robust variety of cars, tracks and challenges with ground-breaking social interaction all while allowing players to revel in their car passion like never before thanks to the power of Kinect."
819,679656,Foul Play,"Prepare for DRAMA as the Baron's tale unfolds, from the harsh deserts of Cairo, to the shady streets of Victorian London... and beyond. The finest actors and actresses of the day have been employed to ensure the ABSOLUTE authenticity of the story. Prepare to play out the most spectacular and explosive moments of the Baron's life; improbable beasts, astonishing villainy, and at the heart of it all - the mysterious Foul Play."
820,939322,Fracture,"Fracture advances players to the year 2161, where the effects of global warming have altered the planet's landscape, and a clash in ideologies over human enhancement places society on the threshold of war. In utilizing the core gameplay mechanic of Fracture, a destructive next-generation technology known as Terrain Deformation, players are equipped with an arsenal of futuristic weaponry to strategically reshape their surroundings on the fly. Every action they perform dynamically reshapes the earth in ways no videogame has.Players set foot on the frontlines of this epic conflict in the role of Jet Brody, a demolitions expert fighting for the Atlantic Alliance, who rely upon cybernetic enhancement. Pitted against the genetically enhanced soldiers of the Pacifican army, players will experience a revolution in 22nd-century warfare. When Brody throws a tectonic grenade onto a level battlefield, the ground blasts upward providing access to otherwise unreachable areas or providing cover against approaching enemies. Surrounded on all sides by Pacifican forces, Brody heaves a vortex grenade, creating a swirling tornado-like mass of boulder, dirt and debris to dispatch his foes. These are just a few samples of the possibilities for Terrain Deformation. Players not only change the battlefield - they change the face of the battle itself."
821,944059,Fragile Dreams: Farewell Ruins of the Moon,"Seto is a young boy that is extremely special; he may be the last human being alive on the planet. In a post-apocalyptic world that's covered in fog and has lost its light, he searches abandoned cities tirelessly with a flashlight in hopes of finding other humans, any human. As Seto searches through these eerily calm and beautiful ruins of a civilization lost, he comes across a mysterious girl named Ren, who quickly scurries away from him despite possibly being the only other living human in the world. As he struggles to be reunited with Ren and search for other survivors, he must fight off the ghosts and demons that haunt this forsaken land while also piecing together the mystery of what brought about the disappearance of all mankind."
822,945610,Freddi Fish: Kelp Seed Mystery,"The Nancy Drew of the sea, Freddi Fish helps kids solve underwater mysteries. Level 2 (primarily for children ages 5 to 7)."
823,976089,Free Running,"Parkour, the art of movement, is less a sport and more a way of life. Its participants, known as Free Runners or Traceurs, view the environment and its obstacles, urban or natural, as a series of challenges to be overcome. To the Traceurs, parkour has a philosophical appeal: they feel transformed by the experience, free from the grind of city life. Since its inception in Paris during the mid-1980s, it has spread across the globe and now has an international army of exponents and enthusiasts. In Free Running, the concrete jungle becomes your urban playground as you run, vault, jump or climb over obstacles in the most fluid and flowing manner possible. Test the boundaries of human ability as you perform death-defying leaps and jaw-dropping trips across inner-city rooftops. To be crowned King of Parkour, you must master over 50 moves, tricks and stunts including 'Kong Vaults', 'Pharaoh Climbs', 'Rail Split Vaults' and 'Vertical Wall Runs' in a variety of game modes while racing against human or computer-controlled competitors."
824,729300,Freefall Racers,"Freefall Racers is a Racing game, developed by Smoking Gun Interactive and published by Deep Silver,  which was released in 2013."
825,960530,Fret Nice,"Fret Nice harmonizes the unity between music and the 2D platformer. As you control your character through the artful stages, you play the game as if it were a jammin' rock song. Rock out by blasting enemies with riff combos and creating your own soundtracks with each strum of a chord. Each time a stage is repeated, you will have an ever-changing experience!"
826,933056,Frogger,"Enjoy the classic game Frogger, revitalized and brand spanking new on your Xbox 360. With enhanced artwork building on the original title's style, modernized sound and music, and all new play modes, this is an Xbox Live Arcade title you won't want to miss out on.Whether you've had your hands on the original or not, Frogger's fast paced and addictive gameplay is ready for it's latest incarnation on Xbox Live."
827,946847,Frogger 2,"Hop along with Frogger 2 as you travel through more than 15 challenging levels filled with new enemies and obstacles. Each of the five exotic environments provides a new set of challenges, but beware of the bosses that try to thwart your progress. Compete with up to four friends in two different online multiplayer modes and hop your way to victory."
828,978134,Frogger Returns,"In Frogger Returns, players are thrown back into the hustle and bustle of city life to guide their amphibious friend, Frogger, from the city back to his home marsh. Frogger Returns stays true to the classic arcade gameplay style, but is enhanced with improved graphics, a new camera angle, and new levels. Streets, sewers, subways, and numerous other obstacles and enemies are in play - all for the sake of keeping Frogger away from returning home!"
829,664523,Frogger: Hyper Arcade Edition,"Frogger's coin-op thrills are back and better than ever in Frogger: Hyper Arcade Edition! The arcade excitement of Frogger returns in time for its 30th anniversary celebrations with updates that are sure to delight fans old and new. Players can jump into the action with classic and brand-new game modes like Tile Capture, Battle Royale, Freak Out and more that expand the challenge of Frogger's style of run-and-dodge gameplay. Players can even customize their game experience through a variety of different skins, from the modern neon style of HYPER ARCADE to the 8-bit sprites from Frogger, Castlevania and even CONTRA! Competitive types can also throw down against friends or the CPU in up to 4 player matches to find out who's really the top frog!"
830,997722,From Dust,"From Dust is the latest original game concept by Eric Chahi, creator of the cult classic, Another World / Out of this World. Immerse yourself in a world as exotically beautiful as it is dangerous! You control the destiny of a primitive tribe against the backdrop of a world in constant evolutiona universe where mighty Nature reclaims what is hers; and your mastery of the elements is your peoples only chance of survival..."
831,959895,Front Mission Evolved,"In the year 2171, the lines between nations have been redrawn.  The newest installment of the Font Mission series takes you down to ground level, letting you control both wanzers and pilots from a visceral third-person view.  Experience intense battles around the globe as you unravel an intricate and insidious conspiracy."
832,932615,Frontlines: Fuel of War,"Set in the near-future based on today's headlines, Frontlines-: Fuel of War- throws players into the middle of the world's next great war. As society succumbs to a worldwide energy crisis, two superpower alliances emerge... Join the battle with the Western Coalition or the Red Star Alliance!Choose a faction and team up with 64 other people in massive online multi-player battles, or assume the roles of the individual soldier to play a key role in an intensely cinematic single-player campaign. Frontlines-: Fuel of War- features a high-tech array of realistic near-future weapons and combat vehicles drawn from real world military designs. Experience the new high stakes, fast paced, futuristic warfare!"
833,632841,Fruit Ninja Kinect,"YOU are the ninja! The worldwide gaming phenomenon Fruit Ninja has now arrived for Kinect! Your arms are now blades, and the epic battle against the worlds most delicious produce is just beginning. Fruit Ninja Kinect is an amazingevolution of the slice-em-up genre created by Halfbrick, utlising next-gen power for the juiciest combat ever! With Classic, Zen and the frenetic Arcade Mode, Fruit Ninja Kinect includes all the action you know and love with precisioncontrol - along with special features exclusive to Kinect! With Party Mode, multiple players can turn a normal night into a fierce tournament - and the new Challenge system will reveal the true masters among your friends!"
834,952474,Fuel,"FUEL delivers exhilarating, spectacular races, at any time of day in a huge range of vehicles. Experience the dynamic weather system and witness how deadly tornadoes and sandstorms affect the way your race plays out. Negotiate diverse terrain from deep snow to arid riverbeds, battle the elements and pull off stunning stunts as you race and explore an epic world on an unprecedented scale."
835,661202,Fuel Overdose,"In a world where modern societies as we know them no longer exist, Fuel Overdose is bringing the action racing experience to a new level. Customizable weapons and vehicles, grappling hooks, climatic catastrophes as well as a whole fighting system are at your disposal to finish first. You'll have to play hard, but also to play smart as every decision made before or during the race has an impact on your chances of success."
836,928116, ,"Racing and combat combine in the arcade-style racing game Full Auto. You can choose from 20 cars and 10 different weapons, which can be used to outrun and outgun your opponents. The unwreck meter allows you to rewind a limited amount of time to undo your mistakes. The game includes pursuit, arena, tag and rampage modes, as well as a 60-event campaign mode and a host of minigames. You can also play online, challenging other gamers via Xbox Live."
837,932850,Full Auto 2: Battlelines,"Full Auto 2: Battlelines puts high-speed vehicles outfitted with weapons and armor into fully realized and fully destructible urban street environments. Fierce combat-racing will ensue as you strategically use destruction to win races as well as leave massive devastation in your wake. Players can destroy the environment to dynamically change track conditions to block competitors, open new paths, or crush opponents with falling debris caused by well-timed missiles. Full Auto 2: Battlelines also introduces a new Arena Mode featuring team play and six different levels, each specifically designed for a unique type of multiplayer car combat. In the new multi-path single player campaign, players battle to take control of Staunton City by conquering the six different districts and taking control of opponent cars and weapons. The game's six different carnage-filled multiplayer modes, which incorporate team play and objectives ranging from classic deathmatches to unique base assaults and gladiator-style gameplay, deliver a diverse range of competitive options. The sequel implements the fan-favorite Unwreck feature, which allows players to turn back time and take another shot at a treacherous turn, avoid a deadly obstacle, or simply avoid enemy fire."
838,618628,Full House Poker,"Compete against your Xbox LIVE friends on Xbox 360 and build your bank roll on the go with a companion game on Windows Phone 7. Play a quick two-player game for some lightning action, join a big 30-player tournament, or play a round of Texas Heat, our live poker game show where you play with thousands of players worldwide and have 30 minutes to bluff, bet, and raise your way to the final table!"
