1097,660672,Karateka,"*IMPORTANT* Karateka requires iPhone 4S or newer, iPad 2 or newer, or 5th-gen iPod Touch. Instantly, addictively fun -MacLifeKarateka will charm you with its classic love story set in feudal Japan. Fight to save the lovely Mariko from the evil warlord Akuma and reunite her with her True Love! For those who remember the original, the new Karateka must not be missed. And to those with no prior knowledge: you have a excellent, new experience in store. -Touch Arcade (4.5 stars)With a stunning makeover and simplistic but compelling action, this terrific update brings Karateka into the 21st century in style. -Cnet****BREATHTAKINGLY CINEMATICFrom PRINCE OF PERSIA creator Jordan Mechner, the original side-scrolling karate classic comes to new life on iPad and iPhone with art by Jeff Matsuda (The Batman) and music by Grammy-winning composer Christopher Tin (Civilization IV).FANTASTIC FIGHTINGEasy to grasp yet challenging to master, the rhythm-based karate combat tells a simple human story. Three suitors vie to save Mariko: A fearsome Brute, a noble Monk, and her brave True Love.HIGHLY REPLAYABLEA brilliant life system that delivers variety in the gameplay as well as incredible replay value; you won't want to stop playing until you rescue Mariko as her True Love and see the storybook ending. - Touch ArcadePUNCH THE HAWK!Fun for those of us who played the original on an Apple II, Commodore 64, or even an NES, but younger gamers will still appreciate the unique style and easy-to-learn gameplay. -ArsTechnicaKarateka is widely considered to be one of the greatest 8-bit home computer games ever created. It wasn't a game so much as a living story that you, the player, were a part of... The new Karateka legitimately feels like it might be what Mechner's original idea would have been, if then were now. - Touch Arcade*IMPORTANT* Karateka requires iPhone 4S or newer, iPad 2 or newer, or iPod Touch (5th generation). Karateka does NOT support earlier devices such as iPad 1, iPhone 4, and iPhone 3GS."
1098,959073,Katamari Forever,"Use the Prince's katamari to roll up everyday objects in each level. The more objects that the Prince rolls up, the larger his katamari becomes, allowing him to roll up bigger items. The Prince faces his toughest challenge ever as Katamari Forever boasts the largest collection of stages, modes, songs, and cousins to date. Remixed classic Katamari Damacy tunes, a brand-new storyline, multiple new visual effects and 1080p graphics round out Katamari Forever into the ultimate Katamari experience ever. A terrible event has occurred causing the stars to disappear from the night sky and the King of All Cosmos to fall into a coma. The Prince must use his finely tuned Katamari rolling skills once more to re-create the absent celestial bodies, save his royal father and restore order to the Cosmos. Thumb tacks, sushi, cats, people, skyscrapers, ocean liners and continents - nothing is safe as the Prince makes his way through the largest variety of stages in a single Katamari game ever. New graphical styles give Katamari Forever a certain je ne sais quoi that all new Katamari games possess. A few of the new styles include Wood, which uses warm sepia tones to give stages a wooden feel, while Comic creates thick black outlines on every object while filling them in with deep, rich colors. Make sure to try them all out and find your favorite for a totally new way to experience the world of Katamari. In addition to all these great new features, Katamari Forever also contains local cooperative and competitive multiplayer modes. Choose your favorite cousin and play together or compete in heated Katamari competition. Who will become the Katamari champion in your house?"
1099,943136,Kawasaki Jet Ski,"Kawasaki Jet Ski is a perfect titles for the Wii. Not only does it deliver exciting gameplay, playability and challenges, but it also shows what the Wii hardware is capable of amazing huge, clean 3D worlds with mind-blowing effects. Created under license by Kawasaki, Kawasaki Jet Ski offers entry to the exciting world of this high adrenaline water sport. Grab your wetsuit and open the throttle. Kawasaki Jet Ski is here!"
1100,943137,Kawasaki Snowmobiles,"Skip across the tundra, power over freshly settled snow and feel the thrill of overtaking your opponents at high speed whilst pulling off some crazy stunts. Kawasaki Snow Mobiles delivers a thrilling sensation of speed and snow! These are awesome machines in amazing environments. Climb aboard for the thrill of a lifetime."
1101,990007,Kick-Ass,"Kick-Ass is a fully 3D action fighting game set in the third-person perspective, where the player can play and control modern day super heroes based on the super characters found in the film of the same name. Gamers will be able to play as the three primary characters in the film - Kick-Ass, Hit Girl, and Big Daddy. The story-driven game draws heavily from the strengths of the intellectual property; an action combat game where the characters finally grow sick of the crime around them, and decide that they will do something about it. Featuring multiple environments within New York City, players will be faced with eight story missions and encounter frantic super hero action as they face petty thugs and powerful mob bosses. Players will also have a blast with sub-missions and mini-games, to add even more gameplay to the mix. Staying true to the intellectual property, the game will feature visceral combat and plenty of gore, as the player's main goal is to bring justice back to the city, no matter what the cost!"
1102,943138,Kidz Sports Basketball,Take control of your favorite Kidz Sports characters in some of the wackiest games of full-court 3-on-3 ever!
1103,943139,Kidz Sports Ice Hockey,Get your skates on and take control of your favorite Kidz Sports characters in some of the wackiest games of ice hockey ever!
1104,943135,Kidz Sports International Soccer,Take control of your favorite Kidz Sports characters in some of the wackiest games of international soccer ever!
1105,666508,Killer Is Dead,"Killer Is Dead is the latest title from the demented mind of celebrated game creator, SUDA51, serving as a spiritual successor to his previous cult favorites, No More Heroes and Killer 7. Stylish cel-shaded visuals set the mood in this gritty, bloody, ultra-violent world where biomechanical augmentations increase the power of criminals and executioners alike. Mondo Zappa, a newly recruited executioner, hunts criminals wielding a Japanese sword in his right hand, and the crushing power of biomechanical engineering in his left."
1106,928377,Killzone 2,"Two years after the Helghast assault on Vekta, the ISA is taking the fight to the enemy's home world of Helghan. The ISA goal is direct: capture the Helghast leader, Emperor Visari, and bring the Helghast war machine to a halt. Assuming the role of Sev, a battle-hardened veteran and a member of the special forces unit known as the Legion, players lead a group of highly trained soldiers on a mission to take out the Helghast threat. For Sev and his squad, the invasion of Helghan is just the beginning. Tasked with securing Pyrrhus, the Capital City, the team quickly discovers that the Helghast are a formidable enemy on their home planet. Not only have they adjusted to the planet's hostile conditions, they have also harnessed a source of power they can now use against the ISA. Sev discovers his squad isn't just fighting enemy forces their fiercest opponent may be the planet itself."
1107,996959,Killzone 3,"Developed by Guerrilla Games, a wholly owned subsidiary of Sony Computer Entertainment Europe, Killzone 3 is the latest title in the Killzone franchise, bringing the most robust first-person shooter experience exclusively for the PlayStation 3 system.  Following on the heels of the highly acclaimed Killzone 2, players will once again face the hostile Helghast army, battling overwhelming odds in the fight for human survival.  Killzone 3 delivers the definitive cinematic sci-fi war experience with an immersive single-player campaign as well as full featured multiplayer action in the war against the Helghast."
1108,683181,Killzone HD,"Relive the original Killzone experience in high-definition 720p and new Trophy support Originally released for PlayStation 2 in 2004, Killzone tells the story of Jan Templar, an ISA Captain whose home planet comes under attack from a Helghast invasion army. Together with a hot-headed sergeant named Rico, a deadly Shadow Marshal known as Luger, and the half-human, half-Helghast spy Hakha, Templar must attempt to reactivate the Orbital Defense Platform and drive the invading forces from his planet Vekta.This rip-roaring introduction to the Killzone universe has been remastered in HD. Featuring a single-player campaign with four playable characters and an offline multiplayer mode against AI opponents, Killzone HD has received a thorough audiovisual overhaul: the game boasts 720p graphics at a steady 30fps, with MSAA filtering, sharper textures and higher quality sound effects."
1109,997630,Kinect Adventures!,"Kinect Adventures will get you off the couch and into the game in a whole new way.  You and your friends and family will jump, dodge, and kick your way through 20 of pulse-pounding adventures set in exotic locations. Work together as you navigate through roaring rapids, challenge obstacle courses or save a leaky underwater laboratory. Show off and share your accomplishments online with Photo Moments and Living Statues. The spirit of adventure awaits!"
1110,960507,Kinect Joy Ride,"Put your avatar behind the wheel of a vehicle you select and customize to match your personal style, and drive your avatar WILD. Trick out your avatar with styles and animations to guarantee you'll stand out in the crowd. The game universe constantly evolves and expands with new downloadable content, including new stunt parks, tracks, cars, car upgrades, avatar clothing and animations, and new events. Once you're all customized, take your avatar out for a spin. Make friends around the world as you catch huge air, pull off crazy stunts, and participate in fun community events."
1111,672909,Kinect Nat Geo TV,"Kinect Nat Geo TV mixes family TV night with family game night by combining Kinect's reach in and explore interactivity with amazing, award-winning content from Nat Geo WILD. Solve mystifying puzzles, learn about the natural environment, get to know exotic animals and get inspired to care for the planet."
1112,690455,Kinect Party,"Kinect Party is a Miscellaneous game, developed by Double Fine Productions and published by Microsoft Game Studios,  which was released in 2012."
1113,652585,Kinect Rush: A Disney-Pixar Adventure,"Kinect Rush: A Disney-Pixar Adventure, an exciting racing adventure game, invites families and fans of all ages to experience the worlds of five beloved Disney-Pixar films like never before. Through the magic of Kinect for Xbox 360, become part of one of five Disney-Pixar worlds and team up with characters from The Incredibles, Ratatouille, Up, Cars and Toy Story to race against time and solve time-based challenges without ever leaving your living room."
1114,672908,Kinect Sesame Street TV,"Kinect Sesame Street TV is a revolutionary new 2-way TV experience exclusive to Kinect for Xbox 360 that allows children to literally jump into Sesame Street, interact with favorite characters, play in their world and learn together. The magic of Kinect for Xbox 360 transforms passive viewing into active participation, encouraging children to use their gestures, voices and bodies to interact with content on the screen."
1115,997628,Kinect Sports,"With Kinect Sports, anyone can become the next star of the living room, and it's fun no matter how fit you are. Add your style to any of the six action-packed games - Soccer, Volleyball, Track & Field, Bowling, Table Tennis or Boxing - with Full Body Play. Compete against yourself to set a personal best or win as a team. Either way, you will unlock new content and thrills as you play"
1116,632876,Kinect Sports: Season Two,"Kinect Sports: Season Two pulls the whole family off the couch and turns your living room into a world-class sports arena where intuitive, full-body gameplay and friendly competition reign supreme. Following the top-selling and award-winning Kinect Sports: Season Two, the second season amps up the action and delivers sporting gameplay like youi?ve never seen i? or felt i? before!"
1117,997652,Kinect Star Wars,"Kinect Star Wars brings the Star Wars Universe to life like never before. Harnessing the controller-free power of Kinect for Xbox 360, Kinect Star Wars allows fans to physically experience training as a Jedi, using the Force and battling with a lightsaber. Using full body motions, players can live out the ultimate Star Wars fantasy, no controller required."
1118,632874,Kinect: Disneyland Adventures,"Experience a place where two magical worlds unite: Kinect for Xbox 360 invites you to take a journey where stories come to life and dreams come true, right in your living room! Explore Disneyland park i? from Main Street U.S.A. to Critter Country i? join Peter Pan to battle Captain Hook, high-five Mickey Mouse or hug Snow White.Harnessing the controller-free magic of Kinect for Xbox 360, Kinect: Disneyland Adventures allows children, families and Disney fans of all ages to explore Disneyland park, step into adventures based on attractions, engage in challenging quests and interact with beloved Disney characters using their full bodies and voices,* no controller required. Kinect: Disneyland Adventures is your portal to a magical world of Disneyland park adventures through Kinect."
1119,997629,Kinectimals,"When you meet your Kinectimals cub for the first time, something magical happens. A friendship is immediately formed, and you quickly begin imagining all the wonderful places youi?ll explore and the curious things youi?ll discover together.  Kinectimals has five different exotic animals to choose from, each one of them more adorable then the next. Teach them commands, play with your animal and compete in contests. This is the beginning of a wonderful and lasting friendship."
1120,639173,Kinectimals: Now with Bears!,"Your family gets bigger in this extended release of Kinectimals. Joining the original feline cubs, now play with cuddly bear cubs as you solve a new mystery on an undiscovered island! Share exciting adventures and fun challenges as you teach your best friends new tricks using your voice and body to interact naturally with them."
1121,939214,King of Clubs,"King of Clubs is an innovative action-puzzle game, combining the challenge of the traditional ball-rolling puzzler with the classic tacky seaside pastime of mini-golf. As an evolution of the ball-rolling puzzle genre, each level has multiple solutions, and as further equipment is unlocked, new paths through each hole become viable. Building on the great tradition of sorry-looking mini-golf courses, the game is set in a dilapidated theme-park which takes decaying kitsch to new extremes."
1122,684080,Kingdom Hearts HD 1.5 ReMIX,"Fully remastered in HD, KINGDOM HEARTS HD 1.5 ReMIX is a compilation of the critically acclaimed KINGDOM HEARTS FINAL MIX, previously exclusive to the Japanese market, and KINGDOM HEARTS Re:Chain of Memories. In addition, the two-in-one-disc package will feature HD cinematic story videos from KINGDOM HEARTS 358/2 Days, enhanced gameplay mechanics and PlayStation 3 system trophies. Players can now relive the origins of the celebrated franchise with Sora, Riku and the colorful cast of Disney characters, including Mickey, Donald and Goofy."
1123,735143,Kingdom Hearts HD 2.5 ReMIX,The Magical Saga Continues In Three Remastered Journeys- Kingdom Hearts II Final Mix - The story is not over- Kingdom Hearts Birth by Sleep Final Mix: Destiny is never left to chance- Kingdom Hearts Re:Coded - HD Remastered Cinematics
1124,932035,Kingdom Under Fire: Circle of Doom,"Departing from Action RTS formula of the previous Kingdom Under Fire series, Circle of Doom makes full use of the Xbox 360's power to present adrenaline-pumping action with stylish combat maneuvers and eye-popping effects. Players explore randomly generated vast dungeons and battle monsters swarming the screen in thousands and attacking from all directions along the floors, walls, and ceilings of the dungeons. As the game progresses, the heroes will find increasingly devastating and spectacular ways to defeat massive enemy forces in the forms of new abilities and weapons, or even create their own arsenal by combining the existing ones."
1125,991144,Kingdoms of Amalur: Reckoning,"Reckoning combines visceral third person action combat with deep exploration, expansive character development, and immersive storytelling in a high fantasy universe. Gamers mysteriously rise from the dead and are thrust into a bloody conflict between multiple races, factions, and alliances as they vie for the secrets of immortality and the ancient magic that threatens to destroy the world."
1126,667820,Kirby's Dream Collection: Special Edition,"Jump into an interactive celebration of Kirbys 20th anniversary with Kirbys Dream Collection Special Edition! The package includes 6 classic Kirby titles along with several brand-new Challenge Stages like the ones in Kirbys Return to Dream Land (Wii), a 45-song music CD, a 48-page anniversary booklet filled with the details of Kirbys creation and history and interactive timeline to learn everything about Kirby. This is certainly the special package Kirby fans of all ages have been waiting for.*   6 Classic Kirby games included in one package:    Kirbys Dream Land (Game Boy, April 1992 release)    Kirbys Adventure (NES, May 1993 release)    Kirbys Dream Land 2 (Game Boy, March 1995 release)    Kirby Super Star (Super NES, Sept. 1996 release)    Kirbys Dream Land 3 (Super NES, Nov. 1997release)    Kirby 64: The Crystal Shards (N64, June 2000 release)*    Brand-new Challenge Stages like the ones in Kirbys Return to Dream Land (Wii)*    Kirby 20th Anniversary Soundtrack CD (Featuring 45 Kirby songs)*    Immersive and Interactive Timeline to see footage and box art of all Kirbys game releases.*    48-page booklet featuring various information about Kirbys star-studded career*    Some of the classic games include multiplayer modes."
1127,997761,Kirby's Epic Yarn,Kirby's first console platform game since the Nintendo 64 days introduces an amazing new look based on animated yarn and a world of cloth and textiles. The creative approach is woven directly into the game play and allows the ever-morphing Kirby to take on a variety of new forms. It's a one-of-a-kind platformerthat lets players explore high and low for hidden objects and fun adventure.
1128,935607,Kirby's Return to Dream Land,"Kirby and his friends are back in an adventure designed to satisfy longtime Kirby fans and beginners alike. When an alien spaceship crashes in the otherwise peaceful realm of Pop Star, its pieces are scattered throughout the land. Players must guide Kirby as he retrieves the ships parts and helps the aliens return to their home planet. This time, however, hes not alone. At any time, up to three more players can join in the fun and play as Meta Knight, King Dedede and Waddle Dee to help Kirby in his quest."
1129,954341,Klonoa,"Explore a magical world of mystery and adventure. Join Klonoa on a fantastic journey in the land of Phantomile, where the mysterious crash of a flying ship starts an epic quest through colorful worlds of thrills and danger."
1130,996557,Knights Contract,"Set in the days when a healthy paranoia about witches was considered normal, Knights Contract follows the twisted tale of Heinrich, an immortal executioner, and Gretchen, a resurrected witch.  Once the victim of Heinrich's blade by the order of the game's antagonist, Dr. Faust, Gretchen now has him under her control as the two must work together to rid the land of the supernatural foes who are cursing its people with the black spell of death.Armed with a razor sharp scythe and explosive witchcraft, players will use these tools with spectacular effects in order to return civility to the land.  As players succeed in their journey, they can deal tremendous damage to their on-comers or unleash a gruesome finisher by coordinating the efforts of Heinrich and Gretchen. However, players must also keep a close eye on Gretchen as her mortality is the key to the duo's survival as Heinrich can never be vanquished. It's time to let the combos fly and lay waste to the hordes of darkness with a liberal dose of medieval panache."
1131,678115,Knytt Underground,"Knytt Underground, the sequel to the massively popular Knytt and Knytt Stories, is the next stage in the well-liked series, with the original boasting over 1 million downloads globally. The exciting platform game offers gamers exploration in an infinitely breathtaking atmosphere and will be available on PlayStation 3 and PlayStation Vita later this year."
1132,935579,Kororinpa: Marble Mania,"Kororinpa: Marble Mania is a fun and addictive action puzzle game that lets players tilt and rotate the Wii Remote to roll a ball around a maze to get the goal!  Using an intuitive control scheme, gamers of all ages and skill levels can pick up a Wii Remote and start playing right away. Collect crystals and unlock special marbles and hidden stages as you make your way through the numerous mazes. Varying themes such as a magical forest and neon soaked cityscapes keep the game fresh and entertaining for the whole family."
1133,987422,KrissX,"In KrissX, gamers' must help Wordsworth the Owl on his mission to solve jumbled word puzzles by switching around letters and following clues. If players are successful, they will be rewarded with badges and high scores. As players progress through the game, they can explore 150 vibrant stages while choosing to play at a leisurely pace or facing a timed challenge. With over 3,500 words to unscramble and a variety of game styles including Quests, Time Attack Mode and Timeless Play, gamers can expand their daily vernacular as they discover secret puzzles that provide endless replay value. Addictive gameplay, uncomplicated controls and intuitive tutorials provide an interactive and fun gaming experience for players of all ages."
1134,986296,Kung Fu Funk: Everybody is Kung Fu Fighting!,"Kung Fu Funk is an off the wall 1970's Kung Fu movie themed party game. Players can challenge up to three friends to see who has what it takes to become the ultimate Kung Fu master. There are many trials to overcome in three zany game modes. True to any Kung Fu movie, players start with learning the Zen arts, a chilled out mode to get everyone familiar with the controls. Once skills are waxed the Kung Fu training movie montage begins, which consists of insane mini-games including the plate smash and chopstick fly catch. The ultimate test of skills occurs in the the disco dojo showdown when players enter the Kung Fu disco dojo as the instructor."
1135,945167,Kung Fu Panda,"In the Kung Fu Panda video game, players embark on an epic, action-packed adventure as they master the specialized Kung Fu fighting styles of Po the Panda, the unlikely hero, his teacher Shifu, and the legendary Kung Fu masters, the Furious Five: Monkey, Tigress, Viper, Mantis and Crane.  Through 13 legendary levels from the movie and beyond, and spanning land, water and air, players must work their way to become the Dragon Warrior and defeat the ultimate enemy, Tai Lung, as they battle a variety of foes, overcome dangerous obstacles, navigate multi-tiered environments and solve challenging puzzles."
1136,974805,Kung Fu Rider,"Kung Fu Rider sends players on a wild ride through the busy streets of Hong Kong. Taking on the role of private detective Toby or his assistant Karin, players find themselves on the outs with the mob. When Toby and Karin are confronted by mobsters at their detective agency, players have no choice but to grab their office chairs, hold on tight and slide through the streets in order to make a daring escape. Utilizing the PlayStation Move motion controller, players must steer, jump, dash and power dash through the city while avoiding obstacles and evading attacks in this comical and fast-paced action arcade game."
1137,660048,Kung Fu Strike: The Warrior's Rise,"Kung Fu Strike is an old school action beat-'em-up featuring fast-paced combo-based kung fu fighting. Battle through 28 stages of enemies to earn the most money and highest score based on your performance. Then use your money to learn new attacks, upgrade skills and unlock special Chi Powers in Single Player or local Co-Op. Or take on a friend in Versus Mode to determine who is the best fighter of all."
1138,637876,Kung-Fu High Impact,"Kung Fu High Impact is the first of its kind for Kinect for Xbox 360--a side-scrolling brawler that uses the peripheral's incredibly accurate body tracking technology to insert the real image of the player on screen. The gamer will be literally transported into the action, as he or she will be able to see real-life combat movements interacting with the enemies and objects on screen"
1139,996587,Kung-Fu Live,"Kung-Fu LIVE is an interactive experience unlike anything seen before. With accurate tracking and background removal, the player's real-life image is transported inside the game. Boosted with super-human abilities, the player literally becomes the hero of the game."
1140,638431,Kyotokei,"The powerful witch Rika has invaded the peaceful realm of Estaria with an army of monsters! The magic brothers Kyo and Kei are the only ones who can stop her! Use your powerful aura of protection to absorb the enemy spells and unleash their power all at once! Travel through the dark swamps, cold mountains, dangerous caves full of lava and much more! Face Rika and free Estaria from her menace!"
