969,961724,HB Arcade Cards,"HB Arcade Cards is a great collection of fun and easy-to-play card games. The collection of games included in this title includes: Rummy, Hearts, Euchre, Canasta, Cribbage and the always-classic Solitaire. Each game comes with an interactive tutorial to show you the rules and basic game play. You'll need to be clever to outsmart your opponents, and you can even team up with a computer partner to play Euchre and Cribbage. You can play HB Arcade Cards using a Mii character from your Wii console, or play with one of our four new characters. HB Arcade Cards has lots of style and flare, and will keep you coming back for more. Remember, it's never the same game twice."
970,935985,Heatseeker,Heatseeker will strap you into the pilot-s seat and deliver an exhilarating white-knuckle ride that-ll have you clutching the joypad as you engage in face-melting 6G turns and fight against a seemingly-impossible amount of airborne enemies.
971,943752,Heavenly Guardian,"Explore ancient Japan to find a Cure.The snow goddess Sayuki will battle ghosts, monsters and evil demons to gather the necessary ingredients to create a cure for her beloved, a common boy in the town village. Though their union in forbidden, she will trawerse all of ancient Japan to sawe the one she loves."
972,928391,Heavenly Sword,"A dramatic tale of revenge sees Nariko, a fiery red-haired heroine embark on a quest for vengeance against an invading King and his army. The story builds around the ancient Heavenly Sword which once belonged to a powerful deity and can never be wielded by a mortal without it draining their life-force, killing them within hours. When the invading King (played by Andy Serkis) destroys the warrior clan that guards the Heavenly Sword, the clan leader's daughter, Nariko, takes up the sword in a desperate fight for survival."
973,933123,Heavy Rain,"Experience a gripping psychological crime thriller filled with innumerable twists and turns, where even the smallest actions and choices can cause dramatic consequences. The hunt is on for the Origami Killer, named after his calling card of leaving folded paper shapes on victims. Four characters, each with their own motives, take part in a desperate attempt to stop the killer from claiming a new victim."
974,933065,Heavy Weapon: Atomic Tank,"Heavy Weapon: Atomic Tank unleashes adrenaline-soaked side-scrolling shoot-'em-up arcade action. With a blast of retro eighties videogame chic, Heavy Weapon brings classic shooter action and explosive power to Xbox LIVE Arcade.Fight through 19 story-based missions to upgrade six different weapon banks, or jump into instant action with the blazing Survival mode. Grab your friends and storm across enemy lines in co-operative multiplayer modes! Are you ready for the furious fun of Heavy Weapon?"
975,952602,Helix,"Helix is one of the most innovative music-rhythm games ever designed for the Wii console. Use the Wii Remote? controller to do dozens of exciting moves, including punches, circles, back fists, hooks and more. Be mesmerized by the eye-popping background visuals, which pulse to the beat of the music. Enjoy incredible replay value with 26 songs to play and three difficulty levels. Try to unlock all of the songs. This game is great for getting exercise plus having fun. No buttons are required, so it's easy for anyone to pick up but difficult for even the best players to master."
976,662411,Hell Yeah! Wrath of the Dead Rabbit,"You think 2012 is going to suck? You're probably right. That's why Arkedo came up with Hell Yeah! - the ultimate anti-crisis remedy, a game designed to clear your mind, put a smile on your face and bring a little bit of peace to mankind. But what's it all about?Hell Yeah! is a crazy action-adventure platformer. In Hell."
977,943805,Hell's Kitchen,"Experience the thrill of Hell's Kitchen as you prove yourself to Chef Ramsay. Each day is a new challenge as you work your way towards a 5-star chef, unlocking real recipes as you progress. Master service, preparation and cooking while Gordon Ramsay watches over you- yelling and praising based on your performance. Be careful - if he gets too frustrated, he'll shut down the kitchen!"
978,933078,Hellboy: The Science of Evil,"Hellboy provides players with fresh adventures featuring the acclaimed comic book's unmistakable fusion of action, atmosphere and humor. On the trail of a crazed witch, Hellboy uncovers a Nazi plot for world domination and must rush to defeat the crazed Hermann Von Klempt before he can exert his evil will upon a hapless world. As a visceral brawler, the game lets players unleash Hellboy's superhuman abilities as they smash their way through hordes of enemies with contextual use of the environment for added destructive power and strategy. An original storyline set in the Hellboy universe, filled with classic characters from the comic book. Explosive battle system with contextual grappling commands lets players experience Hellboy's supernatural might as he unleashes the Right Hand of Doom on his enemies. Use strategy to take down hordes of enemies - toss a straggler into the crowd or manipulate the environment to create more manageable groups of enemies. Play as series favorites Abe Sapein and Liz Sherman in cooperative multiplayer modes."
979,954980,Help Wanted: 50 Wacky Jobs,"The world is in danger. A meteor is plummeting towards earth and the only way to save the planet from destruction is to earn enough money to purchase the anti-meteor gadgets from a TV shopping channel! This bizarre storyline is the basis for Job Island: Hard Working People, a quirky and brilliantly entertaining title featuring 50 mini games that must be finished to earn the money to save the word! However, players must perform better than the other workers in order to succeed. Each of the 50 mini games are in fact jobs players must undertake successfully in order to earn money. These jobs range from the simple to the ridiculous and all make use of the Wii Remote and Nunchuk in ways players would never have thought possible. As a red carpet interviewer for example, the player runs around the celebrity laden carpet waiting for them to give interviews. If you get there first and bag the big star, you earn more money! Managing a BBQ grill players must twist the skewers of meat using the Wii Remote to prevent them from burning and as farmer you must harvest carrots as quickly as possible and also milk a cow! Each job requires skill and concentration to complete and will test all gamers, regardless of their skills. With three levels of difficulty and a multiplayer mode that allows two people to go head to head on any of the jobs that are available in a straight heads-up duel, there is plenty to keep everyone entertained and amused."
980,961244,Heracles Chariot Racing,"Heracles Chariot Racing is an exciting journey into a mystical and colourful word of danger spiced with excitement, awesome weapons laced with humour. Featuring Championship, Single Player, Time Trial, Battle and intense 2 to 4 split screen multiplayer modes, players are the master of their own destinies, but with the divine actions of Gods they will require both skill and an element of luck to be crowned champions. Featuring 3 racing cups across 10 courses based on mythological fantasy settings including Nemean Lion, Realm of Hades, The Augean Stables, Stymphalian Lake and Mount Olympus, players select a character and race it out using fantasy weaponry including Zeus lightning rods, tridents, fireballs and more against their opponents."
981,944341,Heroes Over Europe,"Follow the stories of three pilots, an American, a Brit, and a New Zealander, as they take on the Luftwaffe in the key aerial engagements of WWII. Over fourteen mission, these heroes down enemy bombers over London during the Blitz, break French resistance fighters out of a German prison in Operation Jericho, escort B-17 Flying Fortresses into Europe and strike deep into the black heart of the enemy: Berlin.With fourteen missions drawn from real WWII operations and over forty plane variants from the UK, Germany, Russia, Italy and America, including the Spitfire, Hurricane, Fw190, Me 262, Mosquito, P-38 Lightning, P-47 Thunderbolt, and the P-51 Mustang, the player has a massive amount of strategic choice.Heroes Over Europe's multiplayer mode supports up to 16 players on all platforms, with four game modes; Dogfight, Team Dogfight, Survivor and Team Survivor. Pre-balanced multiplayer plane packs give online and LAN players the choice of one of six planes for their battle. Multiplayer games can also be altered with the following modifiers: Weapon Damage Multiplier, Health Multiplier, Unlimited War Speed, Unlimited Primary Ammo, Unlimited Secondary Ammo and Lead Target Bead Visibility."
982,977135,Heron: Steam Machine,"Heron: Steam Machine is a game about a factory where rubber duckies are being produced by a large steam engine. On this steam engine, there are four different gauges which you will have to watch carefully. By connecting the pipes, you will earn points and relieve some of the pressure, keeping the machine running just a little bit longer. If one of the gauges reaches its maximum, the machine will eventually blow up, and the game is over. If you were lucky enough to achieve a high score, make sure you enter your name in the list so other players can compete with you. In Multiplayer, you are able to cooperate with friends in maintaining the steam machine. When you play with two, three or four players, the screen is divided into sections with different background colors. Each player is able to solve his or her own part of the puzzle. Players are restricted to their own section of the screen, so you will have to work together to make the pipes fit properly."
983,941992,Hexic 2,"Building on the success of Hexic HD, Hexic 2 brings all-new pieces to the board and a new multiplayer mode, so you can compete with friends in your living room or over Xbox LIVE. The basic gameplay is straightforward, familiar, and addictive--just spin a trio of hexes to create a group of three or more matching colors, or build a formation of hexes to create more advanced pieces. Whether you want a relaxing puzzle break or a frantic race against the clock, Hexic 2 has you covered!"
984,930853,Hexic HD,"Hexic HD is the next puzzle hit from Alexey Pajitnov, the original creator of Tetris. Rotate groups of three hexes to form clusters of like-colored tiles. Use bonus pieces and starflowers to boost your score and discover new ways to play. But watch out for bombs--clear them before they explode or it's game over."
985,735127,Hexodius,"EXPLORE-EQUIP-ESCAPE!With its potent blend of twin-stick shooting, exploration and customization, HEXODIUS invites players to explore the vast complex, equip their drone with powerful items and upgrades, and ultimately escape the clutches of the deadly enemy droids in a blaze of laser fire!"
986,949715,High School Musical 3: Senior Year DANCE!,"High School Musical 3: Senior Year DANCE! lets fans experience the energy, fun, and music of all three High School Musical movies. Dance to the beat of favorite High School Musical songs in familiar movie locations alongside their favorite characters. Featuring new music from the first theatrical release in the franchise, the game will keep with Wildcat fun moving! Dance to 29 songs from all three High School Musical movies. Play as Troy, Gabriella, Sharpay, Ryan, Taylor, and Chad OR as your own customized Wildcat. Compete with your friends in dance-offs or play together in a dance duo."
987,937722,High School Musical: Sing It!,"Get those vocal cords ready! Based on the phenomenally successful Disney Channel original movie High School Musical, Disney's High School Musical: Sing It! features songs, sets and characters from the original film. this karaoke video game allows fans to interact with the movies' stars for the first time on any gaming console. With 30 songs to choose from, along with 30 minutes of High School Musical bonus footage and cast interviews, High School Musical: Sing It! will be the karaoke game of choice for fans, kids, tweens and families."
988,939457,High Stakes on the Vegas Strip: Poker Edition,"Push the limits in High Stakes! Challenge players head-on in multiplayer mode - now compatible with the PLAYSTATION??Eye and EyeToy USB cameras and may be compatible with other cameras. Download this add-on to play face-to-face with opponents! Play the boards and bluff your way to victory, but don't let any of your tells slip. Don't forget to download the first two add-ons to play all 10 poker styles."
989,939542,High Velocity Bowling,"It's time to bowl - High Velocity style! Meet the High Velocity Bowlers. Each High Velocity Bowler has their own unique personality, skill-set, and attributes. Use the SIXAXIS' wireless controller to simulate a genuine bowling swing with real lane environments, providing a truly next-gen bowling game. Compete to unlock eight distinctive characters and progress through eight themed alleys on their way to bowling domination."
990,955761,High Voltage Hot Rod Show,"High Voltage Hot Rod Show is a slick and fast-paced racer that challenges up to four players to tear up the track on a variety of off-road courses, mastering death-defying stunts and building enough Boost to stomp the competition. Players must learn to tame their monster Hot Rods by nailing ramps, power slides, bunny hops and tricks while avoiding mud pits and smashing through Boost Rings to fill their Boost Meters. Players can compete against seven CPU opponents in Championship mode or set their best lap times in the time trials."
991,943495,Hitman: Absolution,"HITMAN ABSOLUTION follows Agent 47, a cold-blooded assassin, who takes on his most dangerous contract to date. Betrayed by those he once trusted - and now hunted by the police - he suddenly finds himself at the center of a dark conspiracy and must embark on a personal journey through a corrupt and twisted world."
992,932470,Hitman: Blood Money,"When assassins from Agent 47's contract agency, The ICA, are systematically eliminated in a series of hits, it seems a larger, more powerful agency has entered the fray. For Agent 47 it's business as usual, until suddenly he loses contact with The ICA. Sensing that he may be the next target, he travels to America, where he prepares to make a killing. Agent 47 is back and this time he's paid in cold, hard cash. How the money is spent will affect his passage through the game and the weapons at his disposal, resulting in a unique gameplay experience for each player. Powered by a new version of Io's stunning Glacier engine, Hitman: Blood Money delivers the most brutal and realistic simulation of life as the world's deadliest assassin."
993,670455,Hitman: Sniper Challenge,"Developed by IO Interactive A/S, a Square Enix studio, HITMAN: SNIPER CHALLENGE is not part of the main game, but a stand-alone experience to reward fans who pre-order HITMAN: ABSOLUTION. Players can don the suit of Agent 47 as he takes on an exclusive assassination assignment. From a balcony overlooking a rooftop gathering, players will be tasked with taking out Richard Strong, Jr., CEO of Stallion Armaments, along with his entire staff of bodyguards. Skilled players will capitalize on score multipliers, hidden secrets, unlock equipment upgrades and marvel at the many creative ways one can discretely dispose of a body while they work to fulfil their contract in the most efficient way possible."
994,605345,Hoard,"Hoard is an arcade action-strategy score attack game in which you play a dragon intent on ransacking a medieval kingdom to gather a giant hoard of glittering gold.  You must scare towns, kidnap princesses, burn knights, and even topple berserk giants. Let no obstacle prevent you from your treasure hoarding!"
995,955263,Hockey Allstar Shootout,"Use the Wii Remote controller as a stick and take the shot as you compete in three exciting hockey skills challenges. In Head 2 Head, it's just you versus the best goalies in the world in a five-puck shootout. Race against the clock to post the most goals in the fastest time. The three difficulty levels will place you against three increasingly talented goalies, each donning the jersey of his home country. In two-player mode, each player will take a turn as shooter and as goalie, and the player who scores the most goals in five shots is the winner. In Sharp Shooter, you post a high score in one of three difficulty levels by breaking as many targets as you can. Each time a shot fails to break a target, an X will appear in the upper left corner. Three misses and the game is over. Power Shot has you take your best shot and watch the Shot-Speed clock light up. You have three attempts to blast the fastest shot you can, and only the best speeds will grace the high-score list."
996,714467,Hohokum,"A whimsical, colorful game with an emphasis on playful exploration and creativity."
997,633271,Hole in the Wall,"Whether you play solo or with friends, Hole in the Wall challenges  you to become a human puzzle piece as you contort to fit through wacky shapes that are cut out into themed walls hurtling towards you. Try to pass your body through the wall to boost your score, or youll be pushed straight into the water below! Play through different show levels in single or multi player modes (up to 4 competitors), or see if you can handle the challenge of survival mode as you attack wall after wall until you drop! Unlock special customization elements for your avatar like a silver spandex suit, helmets, t-shirt and other zany gear as a reward for progress in the game."
998,945838,Home Sweet Home,"Picture this scene... You move into your new home, and every room is perfect. Every room, except one. Here is the blank canvas for your vision, but you lack the know-how. Who do you call? The Home Sweet Home team! Home Sweet Home will give you the chance to unleash your hidden talents as an interior designer. You choose the furniture, patterns and colors to create a masterpiece that will blow your client away. With simple controls, a fun graphical style and an easy-to-use interface, Home Sweet Home allows you to nurture your creative side. Remember, a house is not a home until it is a Home Sweet Home."
999,960373,Homefront,"The year is 2027. Her infrastructure shattered and military in disarray, America has fallen to a savage occupation by the nuclear armed Greater Korean Republic. Abandoned by her former allies, the United States is a bleak landscape of walled towns and abandoned suburbs. This is a police state where high school stadiums have become detention centers, and shopping malls shelter armored attack vehicles. Join the Resistance, stand united and fight for freedom against an overwhelming military force In Homefront's gripping, cinematic single player campaign penned by John Milius (Apocalypse Now, Red Dawn), and experience epic, ground breaking multiplayer action all set in a terrifyingly plausible near-future world."
1000,941592,Hooked! Real Motion Fishing,"Enjoy the thrill of catching fish without the mess of cleaning them! With this unique Wii fishing game, the Wii Remote and Nunchuk controllers will allow players to relive all the excitement and tension of fishing in the comfort of their own living room. Explore 6 photorealistic lakes, from a meteorite crater turned lake to a man-made recreational reservoir."
1001,999086,HoopWorld,"Long ago, a lost civilization called the Elders, who worshipped the magical power of Nature, built a network of sacred temples around the world. Millennia have since passed, and the temples now lie in ruins. But their energy still resonates from the land, attracting adventurers from distant lands. Drawn by the unknown force, friends have begun to rebuild the ruins into ball courts, knowing only that they must relive the time-honored test of the spirit of the Elders: the game now known as basketball. HoopWorld is a three-on-three basketball game with an arcade twist. Unique characters and beautiful natural locations set the stage, while fighting and random power-ups keep the game fast and rough. Choose your favorite team and basketbrawl across the globe to become the undisputed world champions. Play on your own or with a friend and see if you can beat the leaders of the HoopWorld global ranking."
1002,958810,Horrible Histories: Ruthless Romans,"Horrible Histories: The Ruthless Romans, a fun party game based on the hugely popular children's books by Terry Deary. You take on the role of a young Gladiator making his way to the Coliseum. Learn fighting techniques and explore ancient Rome as you go. Each mini-game has a learning aspect and is set in an entertaining, enjoyable and exciting world."
1003,930083,Hot Shots Golf: Out of Bounds,"Showcasing high definition graphics along with new, more accurate golf physics, Hot Shots Golf: Out of Bounds offers up a new level of immersion to the franchise's signature over-the-top visuals and pick up and play action. Hot Shots Golf: Out of Bounds brings an entirely new element of gameplay control by introducing a shot system that focuses on the player's swing instead of a power meter. Featuring more than 15 zany golfers and caddies, Hot Shots Golf: Out of Bounds adds six new courses to the overall challenge, ranging from pitch-and-putt par three layouts to challenging 18-hole configurations."
1004,704458,Hotline Miami,"Step into the neon-soaked underground of 1980s Miami as bizarre messages on your answering machine seem to be urging you to commit terrible acts of violence - but will you obey? Hotline Miami overflows with raw brutality and skull crushing close combat as you find yourself outgunned and using your wits to choreograph your way through impossible situations. An unmistakable visual style, a driving soundtrack, and a surreal plot that will have you question your own thirst for blood. Bash and blast through over 20 multiscreen levels with 35 unique weapons and collect 25 game-altering masks in one of the darkest and most unusual independent games on the scene."
1005,938000,Hour of Victory,"Hour of Victory allows you to play a key role in the pivotal and cinematic battles from the European and North African theaters of World War II, using the skills and gameplay style you choose. Sneak into enemy territory as a covert operative, storm the gates as a British Commando, or snipe from afar as an Army Ranger - each character's unique attributes will be needed for the fulfillment of the overall objective. Only with all these skills working closely together will you be able to say that you helped define the Hour of Victory."
1006,986202,Hubert the Teddy Bear: Winter Games,"Hubert The Teddy Bear is a party game in which players confront crafty bunnies. Outsmart them in eight winter activities including snow fight, sleigh ride, Christmas tree decoration, fishing, catching a bunny and more. Create a teddy bear and customize it to fit your own style. Choose its name and gender and dress it up by combining elements from plenty of clothes and accessories. Play solo or engage your family and friends by competing in one of the multiplayer modes. As many as 16 players can take part in one competition. Thanks to the balanced levels of difficulty - kid, youngster and adult - everyone can enjoy the game. This collection of casual winter sports provides a new experience for the whole family."
1007,631927,Hulk Hogan's Main Event,It??????s all about the show in the first motion-based wrestling game on Kinect for Xbox 360 that lets players train with mentor Hulk Hogan as they build their own wrestling personalities and learn the art of showmanship to win over the crowd.
1008,991428,Hunted: The Demon's Forge,"Set in a dark fantasy world, Hunted: The Demon's Forge is an unforgettable cooperative action game, pitting you and your partner against waves of vicious enemies. Taking control of either E'lara, a ranged weapon expert, or Caddoc, a master swordsman, you must use a variety of weapons, powerful spells, and cover tactics to battle your way through menacing dungeons, overgrown ruins, and downtrodden towns. Discover secrets and complete co-op-based puzzles whilst exploring the sinister world to discover answers to the game??????s deep, dark mysteries. The dark ages have become corrupted. Heinous creatures have emerged from underground. Townsfolk across the land are disappearing. Upon the promise of their fortune in gold, mercenaries E'lara and Caddoc take on the daunting task of discovering where the innocent villagers have been taken. Their journey will lead them on a dark and twisted path where they will encounter death, slavery, and sacrifice. Travel deep within the world of Kala Moor...and to the secrets of The Demon's Forge."
1009,960629,Hustle Kings,"Set in contemporary and stylish pool bars, the Hustle Kings game allows players to hone in on their billiards skills in one of the most realistic looking billiards settings ever realized. Whether you're a billiards expert, novice, or casual player, Hustle Kings allows all player-types to become naturally immersed into the sport through true-to-life physics and stunning, photo-realistic lighting and graphics. Because the game allows players to emulate most billiards moves done in real-life, players can practice their skills in various game modes such as US 8-Ball, UK 8-Ball (Black-Ball), 9-Ball and Killer, to name just a few. By doing so, they can earn in-game Hustle Kings Credits to wager with against friends and spend in the Hustle Kings Shop. To maximize the personal experience, players will be able to listen to their own music through the XMB and also utilize in-game video chat to interact with other players.  The Hustle Kings game will also have YouTube uploading functionality, global leaderboards, and a ticker on the loading screens which will feature stats and matchmaking"
